id,ror_display,acronym,alias,label,country_name,created,last_modified
https://ror.org/05cmv6g68,Horizon Robotics (China),,"en: Beijing Horizon Robotics Technology Development Co LTD, Horizon Robotics, Inc.; no_lang_code: Dipingxian; zh: 地平线","en: Horizon Robotics, Horizon Robotics (China); zh: 北京地平线信息技术有限公司",China,8/19/2024,8/21/2024
https://ror.org/00mwq1g96,Hartford Financial Services (United States),,"en: Hartford Financial Services Group Inc, Hartford Investment Management Co., The Hartford, The Hartford Financial Services Group Inc","en: Hartford Financial Services, Hartford Financial Services (United States)",United States,8/19/2024,8/21/2024
https://ror.org/05cg4bn76,City College of Calamba,en: CCC,,en: City College of Calamba; tl: Dalubhasaan ng Calamba,Philippines,8/19/2024,8/21/2024
https://ror.org/0520xdp94,Kut University College,en: KUTCU,en: Al-Kut University College,en: Kut University College; ar: كلية الكوت الجامعة,Iraq,8/19/2024,8/21/2024
https://ror.org/03ggvqk67,Al-Amal College for Specialized Medical Sciences,en: ACFSMS,,en: Al-Amal College for Specialized Medical Sciences; ar: كلية الأمل للعلوم الطبية التخصصية,Iraq,8/19/2024,8/21/2024
https://ror.org/01ynzx943,Databricks (United States),,en: Databricks Inc,"en: Databricks, Databricks (United States)",United States,8/19/2024,8/21/2024
https://ror.org/02nbck826,Universidad Politécnica de Tecámac,,es: UP Tecámac,es: Universidad Politécnica de Tecámac,Mexico,8/19/2024,8/21/2024
https://ror.org/02b92xv22,Duolingo (United States),,en: Duolingo Inc,"en: Duolingo, Duolingo (United States)",United States,8/19/2024,8/21/2024
https://ror.org/02yr4wk92,Institut et Haute Ecole de la Santé La Source,,"fr: HES-SO Institut et Haute Ecole de la Santé La Source, Haute Ecole de la Santé - La Source; en: HES-SO La Source, School of nursing",fr: Institut et Haute Ecole de la Santé La Source,Switzerland,8/19/2024,8/21/2024
https://ror.org/003nx8950,BlackSky Global (United States),,en: BlackSky Aerospace,"en: BlackSky Global, BlackSky Global (United States)",United States,8/19/2024,8/21/2024
https://ror.org/058svmp18,Alcaldía de Barranquilla,es: ABQA,es: Alcaldía Distrital de Barranquilla,es: Alcaldía de Barranquilla,Colombia,8/19/2024,8/21/2024
https://ror.org/03jg63j21,Instituto Tecnológico Superior de Tantoyuca,es: ITSTa,es: ITS de Tantoyuca,es: Instituto Tecnológico Superior de Tantoyuca,Mexico,8/19/2024,8/21/2024
https://ror.org/05d37ka75,Freies Institut für Bauforschung und Dokumentation e.V.,de: IBD,"en: Free Institute for Building Research and Documentation, Free Institute for Building Research and Documentation e.V.; de: Freies Institut für Bauforschung und Dokumentation",de: Freies Institut für Bauforschung und Dokumentation e.V.,Germany,8/19/2024,8/21/2024
https://ror.org/05252fg05,Deraya University,,,en: Deraya University; ar: جامعة دراية,Egypt,8/19/2024,8/21/2024
https://ror.org/02w12zj89,Nio (China),,"en: Blue Sky Coming, NextEV, Shanghai Weilai Automobile Co Ltd; no_lang_code: Nextcar, Nio Inc, Nio Limited, Weilai; zh: 蔚来","no_lang_code: Nio, Nio (China); zh: 上海蔚来汽车有限公司",China,8/19/2024,8/21/2024
https://ror.org/001rm8957,Centre for Hydraulic Research,,en: Centre for Hydraulic Research spol. s r.o,en: Centre for Hydraulic Research; cs: Centrum hydraulického výzkumu spol. s r.o.,Czechia,8/19/2024,8/21/2024
https://ror.org/02gqdm821,"Epi Biotech Co., Ltd. (South Korea)",,"no_lang_code: Epi Biotech, Epi Biotech Co., Epibiotech, Stemore","no_lang_code: Epi Biotech Co., Ltd., Epi Biotech Co., Ltd. (South Korea); ko: 에피바이오텍",South Korea,8/19/2024,8/21/2024
https://ror.org/0279hze33,Citizens Financial Group (United States),en: CFG,"en: Citizens Bank, Citizens Bank N.A., Citizens Financial, Citizens Financial Group Inc","en: Citizens Financial Group, Citizens Financial Group (United States)",United States,8/19/2024,8/21/2024
https://ror.org/02e15es11,Marathon Petroleum (United States),,en: Marathon Petroleum Corporation,"en: Marathon Petroleum, Marathon Petroleum (United States)",United States,8/19/2024,8/21/2024
