id,ror_display,acronym,alias,label,country_name,created,last_modified
https://ror.org/02ksqcf75,Didi Chuxing (China),,"en: Beijing DiDi Infinity Technology and Development Co Ltd, Beijing Xiaoju Technology Co., Didi Chuxing Technology Co Ltd, Didi Chuxing Technology Co.; zh: 滴滴, 滴滴出行","no_lang_code: Didi Chuxing, Didi Chuxing (China); zh: 北京小桔科技有限公司",China,8/19/2024,8/21/2024
https://ror.org/05pk81s67,Dish Network (United States),,"en: Dish Network Corp, Dish Network Corporation, Dish Network LLC","en: Dish Network, Dish Network (United States)",United States,8/19/2024,8/21/2024
https://ror.org/03wx30207,EOG Resources (United States),,"en: EOG Resources Inc, Enron Oil & Gas Company, Enron Oil and Gas Company","en: EOG Resources, EOG Resources (United States)",United States,8/19/2024,8/21/2024
https://ror.org/011fcvm83,Aeroflex,,,no_lang_code: Aeroflex,United States,8/19/2024,8/21/2024
https://ror.org/03zqyp327,Cincinnati Financial (United States),,"en: Cincinnati Financial Corp, Cincinnati Financial Corporation, The Cincinnati Insurance Companies","en: Cincinnati Financial, Cincinnati Financial (United States)",United States,8/19/2024,8/21/2024
https://ror.org/01nvq4081,Museum of Glass and Jewellery in Jablonec nad Nisou,,,en: Museum of Glass and Jewellery in Jablonec nad Nisou; cs: Muzeum skla a bižuterie v Jablonci nad Nisou,Czechia,8/19/2024,8/21/2024
https://ror.org/0140bzm64,Society for the Study of Human Development,en: SSHD,,en: Society for the Study of Human Development,United States,8/19/2024,8/21/2024
https://ror.org/035r10384,MORSE (United States),,"en: MORSECORP, MORSECORP Inc, Mission Oriented Rapid Solution Engineering","en: MORSE, MORSE (United States)",United States,8/19/2024,8/21/2024
https://ror.org/008s47275,Pratt & Whitney Rocketdyne (United States),,en: Pratt and Whitney Rocketdyne,"en: Pratt & Whitney Rocketdyne, Pratt & Whitney Rocketdyne (United States)",United States,8/19/2024,8/21/2024
https://ror.org/047ybhc09,"City St George's, University of London",,en: City St George's University of London,"en: City St George's, University of London",United Kingdom,8/19/2024,8/21/2024
https://ror.org/04rqv8543,Bridgewater Associates (United States),,en: Bridgewater Associates LP,"en: Bridgewater Associates, Bridgewater Associates (United States)",United States,8/19/2024,8/21/2024
https://ror.org/00ksf6k80,Darden Restaurants (United States),,en: Darden Restaurants Inc,"en: Darden Restaurants, Darden Restaurants (United States)",United States,8/19/2024,8/21/2024
https://ror.org/02ewr8206,Patel Institute of Science and Management,,,en: Patel Institute of Science and Management,India,8/19/2024,8/21/2024
https://ror.org/0552wkf46,NRG Energy (United States),en: NRG,"en: NRG Energy, Inc","en: NRG Energy, NRG Energy (United States)",United States,8/19/2024,8/21/2024
https://ror.org/053jkh992,Thai Nguyen University of Medicine and Pharmacy,en: TUMP,,"en: Thai Nguyen University of Medicine and Pharmacy; vi: Trường Đại học Y - Dược, Đại học Thái Nguyên",Vietnam,8/19/2024,8/21/2024
https://ror.org/029vc8149,Chongqing Airport,en: CQA,en: Chongqing International Airport,en: Chongqing Airport,China,8/19/2024,8/21/2024
https://ror.org/00n16p182,Martin Marietta Materials (United States),,"no_lang_code: Martin Marietta, Martin Marietta Materials Inc.","no_lang_code: Martin Marietta Materials, Martin Marietta Materials (United States)",United States,8/19/2024,8/21/2024
https://ror.org/03r6wtf12,Aibee (China),,en: Aibee Beijing Intelligent Technology Co Ltd; no_lang_code: Aibee Inc.; zh: 爱笔智能,"no_lang_code: Aibee, Aibee (China); zh: 爱笔智能科技有限公司",China,8/19/2024,8/21/2024
https://ror.org/030ev1m28,General Hospital of Central Theater Command,,"en: General Hospital of Central Theater Command of People's Liberation Army, PLA General Hospital of Central Theater Command, People's Liberation Army General Hospital of Central Theater Command",en: General Hospital of Central Theater Command; zh: 中国人民解放军中部战区总医院,China,8/19/2024,8/21/2024
https://ror.org/038dc7m35,CSX (United States),,"no_lang_code: CSX Corp, CSX Corporation","no_lang_code: CSX, CSX (United States)",United States,8/19/2024,8/21/2024
https://ror.org/053yszt22,Exelon (United States),,"en: Exelon Corp, Exelon Corporation","en: Exelon, Exelon (United States)",United States,8/19/2024,8/21/2024
https://ror.org/03158q453,Animal and Plant Inspection and Quarantine Technology Center of Shenzhen Customs District,en: APIQ,,en: Animal and Plant Inspection and Quarantine Technology Center of Shenzhen Customs District; zh: 深圳海关动植物检验检疫技术中心,China,8/19/2024,8/21/2024
https://ror.org/01s63dd48,A.O. Smith (United States),,"no_lang_code: A. O. Smith, A. O. Smith Corporation","no_lang_code: A.O. Smith, A.O. Smith (United States)",United States,8/19/2024,8/21/2024
https://ror.org/01qz28660,Alfa University College,,en: Alfa International College,en: Alfa University College,Malaysia,8/19/2024,8/21/2024
https://ror.org/05w630g93,PG&E Corporation (United States),,en: Pacific Gas and Electric Company,"en: PG&E Corporation, PG&E Corporation (United States)",United States,8/19/2024,8/21/2024
https://ror.org/01dfznc08,Rock Flow Dynamics (United Kingdom),en: RFD,,"en: Rock Flow Dynamics, Rock Flow Dynamics (United Kingdom)",United Kingdom,8/19/2024,8/21/2024
https://ror.org/055rbnx68,Vulcan Materials (United States),,"en: Vulcan Materials Co, Vulcan Materials Company","en: Vulcan Materials, Vulcan Materials (United States)",United States,8/19/2024,8/21/2024
https://ror.org/01y92wg94,Universidad Tecnológica de Querétaro,es: UTEQ,en: Technological University of Querétaro,es: Universidad Tecnológica de Querétaro,Mexico,8/19/2024,8/21/2024
https://ror.org/04b7gmr83,Eversource Energy (United States),,"en: Eversource, Northeast Utilities","en: Eversource Energy, Eversource Energy (United States)",United States,8/19/2024,8/21/2024
https://ror.org/05nyp3428,U.S. Bancorp (United States),,"en: U.S. Bancorp Asset Management, U.S. Bancorp Fund Services","en: U.S. Bancorp, U.S. Bancorp (United States)",United States,8/19/2024,8/21/2024
https://ror.org/03zhyf578,Fonctionnement écologique et gestion durable des agrosystèmes bananiers et ananas,,"fr: UPR Geco, Unité de recherche Geco",fr: Fonctionnement écologique et gestion durable des agrosystèmes bananiers et ananas; en: Functioning and Sustainable Management of Banana and Pineapple,France,8/19/2024,8/21/2024
https://ror.org/01ykjav28,Raymond James Financial (United States),,"en: Raymond James, Raymond James Financial Services Inc., Raymond James Technology and Communications Investment Banking Group","en: Raymond James Financial, Raymond James Financial (United States)",United States,8/19/2024,8/21/2024
https://ror.org/05xk4yb78,"Analyses des eaux, sols et végétaux",,"fr: US Analyses, Unité de service Analyses","fr: Analyses des eaux, sols et végétaux; en: Water, Soil and Plant Analysis",France,8/19/2024,8/21/2024
https://ror.org/00nb55479,Universidad Tecnológica de Manzanillo,es: UTEM,,es: Universidad Tecnológica de Manzanillo,Mexico,8/19/2024,8/21/2024
https://ror.org/01ypbmk97,Verisign (United States),,,"no_lang_code: Verisign, Verisign (United States)",United States,8/19/2024,8/21/2024
https://ror.org/01beh4y53,Franklin Resources (United States),,en: Franklin Resources Inc,"en: Franklin Resources, Franklin Resources (United States)",United States,8/19/2024,8/21/2024
https://ror.org/05et7jg19,Shahid Matangini Hazra Government College for Women,en: SMHGGDCW,en: Shahid Matangini Hazra Govt. General Degree College for Women,en: Shahid Matangini Hazra Government College for Women,India,8/19/2024,8/21/2024
https://ror.org/04m6zg706,Pinterest (United States),,en: Cold Brew Labs Inc; no_lang_code: Pinterest Inc.,"no_lang_code: Pinterest, Pinterest (United States)",United States,8/19/2024,8/21/2024
https://ror.org/05hzcdx60,Yum! Brands (United States),,"en: Tricon Global Restaurants, Yum!, Yum! Brands Inc, Yum! Brands RSC","en: Yum! Brands, Yum! Brands (United States)",United States,8/19/2024,8/21/2024
https://ror.org/05e2f3x89,Universal Health Services (United States),en: UHS,en: Universal Health Services Inc,"en: Universal Health Services, Universal Health Services (United States)",United States,8/19/2024,8/21/2024
https://ror.org/0577njw16,Universitas Nahdlatul Ulama Purwokerto,,id: UNU Purwokerto; en: University of Nahdlatul Ulama Purwokerto,id: Universitas Nahdlatul Ulama Purwokerto,Indonesia,8/19/2024,8/21/2024
https://ror.org/00d7mgz29,Paramount Global (United States),,"en: Paramount, ViacomCBS, ViacomCBS Inc","en: Paramount Global, Paramount Global (United States)",United States,8/19/2024,8/21/2024
https://ror.org/031qgeg72,Asociación Colombiana de Medicina Física y Rehabilitación,es: ACMFR,,es: Asociación Colombiana de Medicina Física y Rehabilitación,Colombia,8/19/2024,8/21/2024
https://ror.org/051f36b19,Asociación Colombiana de Cirugía de la Mano,es: ASOCIMANO,,es: Asociación Colombiana de Cirugía de la Mano,Colombia,8/19/2024,8/21/2024
https://ror.org/000xs1x50,Tusimple (United States),,"en: Beijing Tusimple Future Technology Co Ltd, Tusimple, Inc.; zh: 图森未来","en: Tusimple, Tusimple (United States)",United States,8/19/2024,8/21/2024
https://ror.org/03y6j4b59,Crown Castle International (United States),,"en: Crown Castle, Crowncastle","en: Crown Castle International, Crown Castle International (United States)",United States,8/19/2024,8/21/2024
https://ror.org/027cyf249,"Društvo ekonomista „Ekonomika“, Niš",,sr: Društvo ekonomista „Ekonomika“ Niš,"sr: Društvo ekonomista „Ekonomika“, Niš; en: Society of Economists ""Ekonomika"" Niš",Serbia,8/19/2024,8/21/2024
https://ror.org/04tb90x61,Mininglamp (China),,"en: Beijing Mininglamp Software System Co Ltd, Mininglamp Tech, Mininglamp Technology; no_lang_code: Mingluo Technology; zh: 明略科技, 明略科技集团","en: Mininglamp, Mininglamp (China); zh: 北京明略昭辉科技有限公司",China,8/19/2024,8/21/2024
https://ror.org/000sg7415,Centro Universitario del Sur,"es: CUSUR, UDG CUSUR",es: Universidad de Guadalajara Centro Universitario del Sur,es: Centro Universitario del Sur,Mexico,8/19/2024,8/21/2024
https://ror.org/02ypdzw54,Tecnológico de Estudios Superiores de Chalco,es: TESCHA,es: Instituto Tecnologico de Chalco,es: Tecnológico de Estudios Superiores de Chalco,Mexico,8/19/2024,8/21/2024
https://ror.org/05pht7q62,Instituto de la Democracia,,,es: Instituto de la Democracia,Ecuador,8/19/2024,8/21/2024
https://ror.org/05febkk55,xAI (United States),,,"en: xAI, xAI (United States)",United States,8/19/2024,8/21/2024
https://ror.org/052waam31,Aon (United Kingdom),,,"en: Aon, Aon (United Kingdom)",United Kingdom,8/19/2024,8/21/2024
https://ror.org/0286hg268,The Fafo Institute for Labour and Social Research,,en: Fafo Institute for Labour and Social Research; no: Fafo Institutt for arbeidslivs- og velferdsforskning,en: The Fafo Institute for Labour and Social Research,Norway,8/19/2024,8/21/2024
https://ror.org/027d3b308,American Tower (United States),,"en: ATC LP LLC, American Tower Corp, American Tower Corporation","en: American Tower, American Tower (United States)",United States,8/19/2024,8/21/2024
https://ror.org/00abj3t43,Somerset NHS Foundation Trust,,,en: Somerset NHS Foundation Trust,United Kingdom,8/19/2024,8/21/2024
https://ror.org/03ecnj426,InfectControl,,,no_lang_code: InfectControl,Germany,8/19/2024,8/21/2024
https://ror.org/02hn16782,Climate Equity Reference Project,en: CERP,,en: Climate Equity Reference Project,Canada,8/19/2024,8/21/2024
https://ror.org/05y5xxp70,Fundacao Escola Superior da Defensoria Publica do Estado do Rio de Janeiro,pt: FESUDEPERJ,pt: FESUDEPERJ - Fundacao Escola Superior da Defensoria Publica do Estado do Rio de Janeiro,pt: Fundacao Escola Superior da Defensoria Publica do Estado do Rio de Janeiro,Brazil,8/19/2024,8/21/2024
https://ror.org/054ktxw16,"Biomasse, bois, énergie, bio-produits",,"fr: BioWooEB, UPR BioWooEB, Unité de recherche BioWooEB","en: Biomass, Wood, Energy, Bioproducts; fr: Biomasse, bois, énergie, bio-produits",France,8/19/2024,8/21/2024
https://ror.org/00zkxn351,Information Society Development Institute,no_lang_code: IDSI,ro: Institutul de Dezvoltare a Societății Informaționale,en: Information Society Development Institute,Moldova,8/19/2024,8/21/2024
https://ror.org/00mbeqy34,Cabio Biotech (Wuhan) Biotechnology Co. Ltd (China),,"no_lang_code: CABIO; en: Cabio Biotech (Wuhan) Biotechnology, Cabio Biotech (Wuhan) Biotechnology Co.; zh: 嘉必优","en: Cabio Biotech (Wuhan) Biotechnology Co. Ltd, Cabio Biotech (Wuhan) Biotechnology Co. Ltd (China); zh: 嘉必优生物技术(武汉)股份有限公司",China,8/19/2024,8/21/2024
https://ror.org/0102wtd28,Monolithic Power Systems (United States),,en: Chengdu Monolithic Power Systems,"en: Monolithic Power Systems, Monolithic Power Systems (United States)",United States,8/19/2024,8/21/2024
https://ror.org/00t42b697,Northern Trust (United States),,en: Northern Trust Corporation,"en: Northern Trust, Northern Trust (United States)",United States,8/19/2024,8/21/2024
https://ror.org/02x6ahj98,University of Vavuniya,en: UOV,"en: University of Vavuniya, Sri Lanka",en: University of Vavuniya; ta: வவுனியாப் பல்கலைக்கழகம்,Sri Lanka,8/19/2024,8/21/2024
https://ror.org/03f658435,Union Pacific (United States),,"en: Union Pacific Corporation, Union Pacific Railroad, Union Pacific Railroad Company","en: Union Pacific, Union Pacific (United States)",United States,8/19/2024,8/21/2024
https://ror.org/04kz59847,Pultegroup (United States),,"no_lang_code: Pulte Group, Pulte Homes, Pultegroup, Inc.","no_lang_code: Pultegroup, Pultegroup (United States)",United States,8/19/2024,8/21/2024
https://ror.org/04st7tp96,"CCCC Comprehensive Planning and Design Institute Co., Ltd. (China)",en: CCCC CPDIC,no_lang_code: CCCC Comprehensive Planning and Design Institute; en: CCCC Comprehensive Planning and Design Institute Co.,"en: CCCC Comprehensive Planning and Design Institute Co., Ltd., CCCC Comprehensive Planning and Design Institute Co., Ltd. (China); zh: 中交综合规划设计院有限公司",China,8/19/2024,8/21/2024
https://ror.org/05rbj6w12,STIKES Muhammadiyah Kuningan,,en: School of Health Sciences Muhammadiyah Kuningan; id: Sekolah Tinggi Ilmu Kesehatan Muhammadiyah Kuningan,id: STIKES Muhammadiyah Kuningan,Indonesia,8/19/2024,8/21/2024
https://ror.org/01hete527,Universidad Politécnica de Cuautitlán Izcalli,es: UPCI,es: UP Cuautitlán Izcalli,es: Universidad Politécnica de Cuautitlán Izcalli,Mexico,8/19/2024,8/21/2024
https://ror.org/05nj19v03,Center for the Analysis of Sustainable Agricultural Systems,en: CASAS,"en: CASAS Global, Center for the Analysis of Sustainable Agricultural Systems Global",en: Center for the Analysis of Sustainable Agricultural Systems,United States,8/19/2024,8/21/2024
https://ror.org/043vfk764,Centre de recherche en Agropastoralisme (CRAPast),,"fr: Centre de recherche en Agropastoralisme (CRAPast), CRAPast",fr: Centre de recherche en Agropastoralisme (CRAPast); ar: مركز البحث في الفلاحة الرعوية,Algeria,8/19/2024,8/21/2024
https://ror.org/019q0z051,Rocky Mountain Advanced Computing Consortium,en: RMACC,,en: Rocky Mountain Advanced Computing Consortium,United States,8/19/2024,8/21/2024
https://ror.org/019wb3548,"Grassroot Soccer, Inc.",en: GRS,en: Grassroot Soccer,"en: Grassroot Soccer, Inc.",United States,8/19/2024,8/21/2024
https://ror.org/04mcp3x60,The Association of Intellectuals for the Development of Science in Serbia “The Serbian Academic Center”,no_lang_code: SAC,"en: Serbian Academic Center, “The Serbian Academic Center” Novi Sad",ru: Oбщество интеллектуалов за развитие науки в Сербии „Сербский aкадемический центр” Нови-Сад; en: The Association of Intellectuals for the Development of Science in Serbia “The Serbian Academic Center”; sr: Удружење интелектуалаца за развој науке у Србији - „СРПСКИ АКАДЕМСКИ ЦЕНТАР”,Serbia,8/19/2024,8/21/2024
https://ror.org/02ftyb663,Disability Community Resource Center,en: DCRC,en: Westside Center for Independent Living,en: Disability Community Resource Center,United States,8/19/2024,8/21/2024
https://ror.org/04p9akw79,Brown-Forman (United States),,"en: Brown-Forman Corp, Brown-Forman Corporation, Brown-Forman and Company",no_lang_code: Brown-Forman; en: Brown-Forman (United States),United States,8/19/2024,8/21/2024
https://ror.org/056nsnt54,MeteoIA (Brazil),,no_lang_code: MeteoIA Datascience LTDA,"no_lang_code: MeteoIA, MeteoIA (Brazil)",Brazil,8/19/2024,8/21/2024
https://ror.org/040asb018,American Electric Power (United States),en: AEP,en: American Electric Power Company Inc.,"en: American Electric Power, American Electric Power (United States)",United States,8/19/2024,8/21/2024
https://ror.org/05gakfp64,Asociación Colombiana de Hepatología,es: ACH,,es: Asociación Colombiana de Hepatología,Colombia,8/19/2024,8/21/2024
https://ror.org/054wd5j92,Guangzhou Baiyun Airport Customs Comprehensive Technical Service Center,en: GBACCTSC,,en: Guangzhou Baiyun Airport Customs Comprehensive Technical Service Center; zh: 广州白云机场海关综合技术服务中心,China,8/19/2024,8/21/2024
https://ror.org/044466k19,Bitmain Technologies (China),,"no_lang_code: Bite Dalu; en: Bitmain, Bitmain Technologies Holding Company, Bitmain Technologies Inc.; zh: 比特大陆","en: Bitmain Technologies, Bitmain Technologies (China); zh: 比特大陆科技有限公司",China,8/19/2024,8/21/2024
https://ror.org/05dgrnf47,Verizon Media (United States),,no_lang_code: Verizon Media LLC,"no_lang_code: Verizon Media, Verizon Media (United States)",United States,8/19/2024,8/21/2024
https://ror.org/03403zv90,Molson Coors Brewing Company (United States),,"en: Molson Coors, Molson Coors Beverage Co","en: Molson Coors Brewing Company, Molson Coors Brewing Company (United States)",United States,8/19/2024,8/21/2024
https://ror.org/04v7gh640,Cloudwalk (China),,en: Cloudwalk Group Co Ltd; zh: 云从科技,"en: Cloudwalk, Cloudwalk (China); zh: 云从科技集团股份有限公司",China,8/19/2024,8/21/2024
https://ror.org/022nvg924,Agari Data (United States),,"no_lang_code: Agari, Agari Data Inc","no_lang_code: Agari Data, Agari Data (United States)",United States,8/19/2024,8/21/2024
https://ror.org/01y60h972,Ramon Magsaysay Memorial Colleges,en: RMMC,,en: Ramon Magsaysay Memorial Colleges,Philippines,8/19/2024,8/21/2024
https://ror.org/009pwww24,IFlyTek (China),,"en: Anhui Ustc Iflytek Science and Technology Co Ltd; no_lang_code: Iflytek Co Ltd, Keda Xunfei Co Ltd; zh: 科大讯飞","no_lang_code: IFlyTek, IFlyTek (China); zh: 科大讯飞股份有限公司",China,8/19/2024,8/21/2024
https://ror.org/05yk70j08,Equifax (United States),,"en: Equifax, Inc., Talx","en: Equifax, Equifax (United States)",United States,8/19/2024,8/21/2024
https://ror.org/022d68h52,Institut für Tourismus- und Bäderforschung in Nordeuropa (NIT) GmbH (Germany),de: NIT,"de: Institut für Tourismus- und Bäderforschung in Nordeuropa, Institut für Tourismus- und Bäderforschung in Nordeuropa (NIT); en: Institute for Tourism Research in Northern Europe","de: Institut für Tourismus- und Bäderforschung in Nordeuropa (NIT) GmbH, Institut für Tourismus- und Bäderforschung in Nordeuropa (NIT) GmbH (Germany)",Germany,8/19/2024,8/21/2024
https://ror.org/01d6p8r58,Instituto Tecnológico de Ciudad Guzmán,es: ITCG,"es: IT Ciudad Guzmán, TecNM Campus Ciudad Guzmán, Tecnológico Nacional de México Campus Ciudad Guzmán",es: Instituto Tecnológico de Ciudad Guzmán,Mexico,8/19/2024,8/21/2024
https://ror.org/04yp7fr64,CoStar Group (United States),,en: CoStar Group Inc,"en: CoStar Group, CoStar Group (United States)",United States,8/19/2024,8/21/2024
https://ror.org/05pdn2z45,Second Affiliated Hospital of Nantong University,,"en: Affiliated Hospital 2 of Nantong University, Nantong First People’s Hospital; zh: 第一人民医院","en: Second Affiliated Hospital of Nantong University; zh: 南通大学第二附属医院, 南通市第一人民医院",China,8/19/2024,8/21/2024
https://ror.org/008khdx92,Comerica (United States),,"en: Comerica Bank, Comerica Inc, Comerica Incorporated","en: Comerica, Comerica (United States)",United States,8/19/2024,8/21/2024
https://ror.org/04mtej177,Al-Kunooze University College,,,en: Al-Kunooze University College; ar: كلية الكنوز الجامعة,Iraq,8/19/2024,8/21/2024
https://ror.org/03x53g461,Fonctionnement agroécologique et performances des systèmes de culture horticoles,,"fr: Hortsys, UPR Hortsys, Unité de recherche Hortsys",en: Agroecological Functioning and Performances of Horticultural Systems; fr: Fonctionnement agroécologique et performances des systèmes de culture horticoles,France,8/19/2024,8/21/2024
https://ror.org/041g6bx17,Faculdade Pernambucana de Saúde,pt: FPS,,pt: Faculdade Pernambucana de Saúde,Brazil,8/19/2024,8/21/2024
https://ror.org/00ffxmn68,Fox Corporation (United States),,en: TFCF Corp,"en: Fox Corporation, Fox Corporation (United States)",United States,8/19/2024,8/21/2024
https://ror.org/05sy8fj60,Anand International College of Engineering,,en: Anand ICE,en: Anand International College of Engineering,India,8/19/2024,8/21/2024
https://ror.org/040b32p69,Megvii (China),,"en: Megvii Inc, Megvii Technology, Megvii Technology Limited, Megvii Technology Ltd; zh: 旷视, 旷视科技","no_lang_code: Megvii, Megvii (China); zh: 北京旷视科技有限公司",China,8/19/2024,8/21/2024
https://ror.org/04yqxr030,Shanghai Marine Meteorological Center,,,en: Shanghai Marine Meteorological Center; zh: 上海海洋中心气象台,China,8/19/2024,8/21/2024
https://ror.org/03c1m7989,Coupang (South Korea),,"no_lang_code: Coupang Co Ltd, Coupang Corp, Kupang Co Ltd; en: Forward Ventures","no_lang_code: Coupang, Coupang (South Korea)",South Korea,8/19/2024,8/21/2024
https://ror.org/00ywema53,EPAM Systems (United States),,"en: EPAM Systems, Inc.","en: EPAM Systems, EPAM Systems (United States)",United States,8/19/2024,8/21/2024
https://ror.org/03d9rgw98,Molina Healthcare (United States),,,"en: Molina Healthcare, Molina Healthcare (United States)",United States,8/19/2024,8/21/2024
https://ror.org/056zprp28,Microsoft Research New York City (United States),en: MSR-NYC,en: Microsoft Research New York,"en: Microsoft Research New York City, Microsoft Research New York City (United States)",United States,8/19/2024,8/21/2024
https://ror.org/02vpw2d22,Rai University,en: RU,,en: Rai University,India,8/19/2024,8/21/2024
https://ror.org/01brjce02,Instituto Tecnológico Superior de Atlixco,es: ITSA,"es: ITS Atlixco, TecNM Atlixco, TecNM Campus Atlixco, Tecnológico Nacional de México Campus Atlixco",es: Instituto Tecnológico Superior de Atlixco,Mexico,8/19/2024,8/21/2024
https://ror.org/02x696c73,EQT (United States),,"en: EQT Corporation, Equitable Resources","en: EQT, EQT (United States)",United States,8/19/2024,8/21/2024
https://ror.org/05h3y2073,Costco Wholesale (United States),,"no_lang_code: Costco, Costco Wholesale Corporation","no_lang_code: Costco Wholesale, Costco Wholesale (United States)",United States,8/19/2024,8/21/2024
https://ror.org/05ctx1h60,Franklin Templeton (United States),,,"en: Franklin Templeton, Franklin Templeton (United States)",United States,8/19/2024,8/21/2024
https://ror.org/022t7x179,ECS (United States),,"no_lang_code: ECS Federal, ECS Federal LLC","no_lang_code: ECS, ECS (United States)",United States,8/19/2024,8/21/2024
https://ror.org/03qq6zv19,Dropbox (United States),,en: Dropbox Inc,"en: Dropbox, Dropbox (United States)",United States,8/19/2024,8/21/2024
https://ror.org/02z2yec16,"Zhongshan Ophthalmic Center, Sun Yat-sen University",en: ZOC,en: Zhongshan Ophthalmic Center,"en: Zhongshan Ophthalmic Center, Sun Yat-sen University; zh: 中山大学眼科中心",China,8/19/2024,8/21/2024
https://ror.org/00wf6p036,IPG Photonics (United States),,en: IPG Photonics Corporation,"en: IPG Photonics, IPG Photonics (United States)",United States,8/19/2024,8/21/2024
https://ror.org/02bw9cj21,Evropski univerzitet Brčko distrikt,bs: EUBD,en: European University Brcko District,bs: Evropski univerzitet Brčko distrikt,Bosnia and Herzegovina,8/19/2024,8/21/2024
https://ror.org/01526xe10,Boston Consulting Group (United States),en: BCG,"en: Boston Consulting Group Inc, The Boston Consulting Group","en: Boston Consulting Group, Boston Consulting Group (United States)",United States,8/19/2024,8/21/2024
https://ror.org/047pw0q71,Steel Dynamics (United States),no_lang_code: SDI,en: Steel Dynamics Inc,"en: Steel Dynamics, Steel Dynamics (United States)",United States,8/19/2024,8/21/2024
https://ror.org/03t5a9538,Instituto Tecnologico Superior de Misantla,es: ITSM,"es: TecNM Campus de Misantla, Tecnológico Nacional de México Campus de Misantla, Tecnológico de Misantla",es: Instituto Tecnologico Superior de Misantla,Mexico,8/19/2024,8/21/2024
https://ror.org/04n901n71,CAIMed - Niedersächsisches Zentrum für KI und Kausale Methoden in der Medizin,,"de: CAIMed, Niedersächsisches Zentrum für KI und Kausale Methoden in der Medizin; en: CAIMed - Lower Saxony Center for AI and Causal Methods in Medicine, Lower Saxony Center for AI and Causal Methods in Medicine",de: CAIMed - Niedersächsisches Zentrum für KI und Kausale Methoden in der Medizin,Germany,8/19/2024,8/21/2024
https://ror.org/057a3cc32,Association de lutte contre le sida (ALCS),fr: ALCS,fr: Association de lutte contre le sida,fr: Association de lutte contre le sida (ALCS),Morocco,8/19/2024,8/21/2024
